{
  "documentType": "clover-ratifier-trust-registry-candidate",
  "schemaVersion": "0.2",
  "status": "configuration-required",
  "principalBindings": [
    {
      "principalId": "owner:chris-dortch",
      "role": "constitution-ratifier",
      "bindingStatus": "not-enrolled"
    }
  ],
  "trustedCredentials": [],
  "minimumAssuranceForRatification": "phishing-resistant-owner-authentication",
  "activationRule": "Constitution 0.2 cannot become ratified-active until a separate authenticated ceremony enrolls an active phishing-resistant owner credential and verifies a process-persistent unconsumed challenge-bound attestation over the exact artifact, displayed statement, and typed ratify-exact-artifact decision. Signed reject or defer decisions are never activation-eligible.",
  "privateKeyPolicy": "Private signing keys and recovery material must never be stored in this public repository.",
  "authorityGrantedByCandidate": []
}
